{
  "$schema": "http://json-schema.org/draft-07/schema#",
  "$id": "Wallet",
  "title": "Wallet or Agent",
  "type": "object",
  "properties": {
    "$schema": {
      "type": "string",
      "description": "The schema version of the agent JSON entry"
    },
    "name": {
      "type": "string",
      "description": "The name of the agent"
    },
    "urlWebsite": {
      "type": "string",
      "description": "An URL to the website of the agent with more information",
      "format": "uri"
    },
    "logo": {
      "type": "string",
      "description": "The URL to the logo of the agent"
    },
    "company": {
      "type": "string",
      "description": "The name of the company or a community developing the agent"
    },
    "companyUrl": {
      "type": "string",
      "description": "The url to the company website (not the product website)",
      "format": "uri"
    },
    "contact": {
      "type": "string",
      "description": "A link to a contact form or an email address for support requests"
    },
    "openSource": {
      "type": "boolean",
      "description": "The agent source code is available under an open-source license"
    },
    "downloadSource": {
      "type": "string",
      "description": "The URL to the source code, for example a github repository",
      "format": "uri"
    },
    "license": {
      "type": "string",
      "description": "The license(s) of the agent source code."
    },
    "capability": {
      "type": "array",
      "description": "The capabilities supported by the agent",
      "items": {
        "type": "string",
        "enum": ["holder", "issuer", "verifier"]
      }
    },
    "operatorModel": {
      "type": "array",
      "description": "Modes of operation this entry supports, as a capability of the wallet or agent (an entry may support more than one, hence an array). The three values sit on one axis, degree of human involvement at the moment of operation: user-operated (a person drives each action), agent-operable (an agent may act, with a human remaining the accountable real-time context), autonomous (an agent acts with no human involvement at that moment). This describes what the entry is designed to support, not what happened in a specific transaction; see the IETF operator-of-record claim (opr, draft-aravind-oauth-operator-of-record) for the per-event marker.",
      "items": {
        "type": "string",
        "enum": ["user-operated", "agent-operable", "autonomous"]
      }
    },
    "executionEnvironment":  {
      "type": "string",
      "description": "Execution environment of an agent is the place where the agent is intended to be run",
      "enum": ["cloud", "edge"]
    },
    "portability": {
      "type": "boolean",
      "description": "Users can export their data from the agent and import them into another device/system"
    },
    "urlAppStore": {
      "type": "string",
      "description": "Link to the Apple AppStore",
      "format": "uri"
    },
    "urlGooglePlayStore": {
      "type": "string",
      "description": "Link to the Google Play store",
      "format": "uri"
    },
    "urlWebApp": {
      "type": "string",
      "description": "Link to the web app - where the agent can be used with a browser",
      "format": "uri"
    },
    "dependencies": {
      "type": "array",
      "description": "List of dependencies required to run the agent",
      "items": {
        "$comment": "it would help to use an enum here, but this job has to be run by each change so the enum gets updated for a valid test.",
        "type": "string"
      }
    },
    "credentialProfiles": {
      "type": "array",
      "description": "List of supported credential profiles. They entries must be valid credential profiles defined by the Credential Profiles Comparison SIG.",
      "$comment": "All values can be found here: https://openwallet-foundation.github.io/credential-format-comparison-sig/#/",
      "items": {
        "type": "string"
      }
    },
    "credentialFormats": {
      "type": "array",
      "description": "List of supported credential formats. They entries must be valid credential formats defined by the Credential Formats Comparison SIG",
      "$comment": "All values can be found here: https://openwallet-foundation.github.io/credential-format-comparison-sig/#/resources/Credential%20Format",
      "items": {
        "type": "string"
      }
    },
    "signingAlgorithms": {
      "type": "array",
      "description": "List of supported signing algorithms. The entries must be valid algorithms defined by the Credential Formats Comparison SIG.",
      "$comment": "All values can be found here: https://openwallet-foundation.github.io/credential-format-comparison-sig/#/resources/Signing%20Algorithm",
      "items": {
        "type": "string"
      }
    },
    "statusManagements": {
      "type": "array",
      "description": "List of supported status management methods. The entries must be valid status management methods defined by the Credential Formats Comparison SIG",
      "$comment": "All values can be found here: https://openwallet-foundation.github.io/credential-format-comparison-sig/#/resources/Status%20Algorithm",
      "items": {
        "type": "string"
      }
    },
    "keyManagements": {
      "type": "array",
      "description": "List of supported key management methods. The entries must be valid key management methods defined by the Credential Formats Comparison SIG",
      "$comment": "All values can be found here: https://openwallet-foundation.github.io/credential-format-comparison-sig/#/resources/Key%20Management",
      "items": {
        "type": "string"
      }
    },
    "issuanceProtocols": {
      "type": "array",
      "description": "List of supported issuance protocols. The entries must be valid issuance protocols defined by the Credential Formats Comparison SIG",
      "$comment": "All values can be found here: https://openwallet-foundation.github.io/credential-format-comparison-sig/#/resources/Issuance%20Protocol",
      "items": {
        "type": "string"
      }
    },
    "presentationProtocols": {
      "type": "array",
      "description": "List of supported presentation protocols. The entries must be valid presentation protocols defined by the Credential Formats Comparison SIG",
      "$comment": "All values can be found here: https://openwallet-foundation.github.io/credential-format-comparison-sig/#/resources/Presentation%20Protocol",
      "items": {
        "type": "string"
      }
    },
    "trustManagements": {
      "type": "array",
      "description": "List of supported trust management methods. The entries must be valid trust management methods defined by the Credential Formats Comparison SIG",
      "$comment": "All values can be found here: https://openwallet-foundation.github.io/credential-format-comparison-sig/#/resources/Trust%20Management",
      "items": {
        "type": "string"
      }
    }
  },
  "required": ["capability", "company", "name", "urlWebsite"],
  "additionalProperties": false
}
