{
  "capability": [
    "issuer",
    "verifier"
  ],
  "operatorModel": [
    "user-operated"
  ],
  "name": "Gateway",
  "logo": "https://wallet-studio.namirial.com/static/img/namirial-wallet-logo.jpg",
  "company": "Namirial S.p.A.",
  "companyUrl": "https://www.namirial.com",
  "urlWebsite": "https://www.namirial.com/en/wallet/",
  "urlWebApp": "https://wallet-demo.namirial.com",
  "openSource": false,
  "portability": false,
  "credentialProfiles": [
    "HAIP",
    "ISO mDL",
    "SD-JWT VCs (w/ X.509 for Issuers)"
  ],
  "credentialFormats": [
    "JWT-VC",
    "JWT",
    "LDP-VC",
    "MDOC",
    "SD-JWT VC",
    "SD-JWT",
    "VCDM 1.1"
  ],
  "issuanceProtocols": [
    "OpenID4VCI"
  ],
  "keyManagements": [
    ".well-known/jwt-issuer",
    "cose key",
    "did:jwk",
    "did:key",
    "did:web",
    "jwks_uri",
    "pub key in X.509 cert",
    "raw public keys (jwk)"
  ],
  "presentationProtocols": [
    "OpenID4VP"
  ],
  "signingAlgorithms": [
    "ECDSA"
  ],
  "statusManagements": [
    "Token Status List (TSL)"
  ],
  "trustManagements": [
    "X.509 certificates"
  ],
  "$schema": "../../schemas/wallet.json"
}